{
  "schemaVersion": 1,
  "contentVersion": 1,
  "status": "review",
  "assessment": {
    "sensitivity": "none",
    "linkedQuestionConcepts": []
  },
  "review": {
    "technicalStatus": "pending",
    "sourceStatus": "pending",
    "pedagogyStatus": "pending",
    "copyrightStatus": "pending",
    "uiStatus": "pending",
    "humanTechnicalStatus": "pending",
    "reviewedAt": null,
    "nextReviewDueAt": null
  },
  "runtime": {
    "startupEligible": false
  },
  "supersession": {
    "supersedesMicroFactId": null,
    "supersededByMicroFactId": null
  },
  "microFactId": "mf_ml9_017",
  "category": "safety_insight",
  "display": {
    "displayText": "ANSI B11 machinery standards use task-based risk assessment to identify hazards and select safeguarding measures for people who operate, maintain, or service machines.",
    "shortVariant": "ANSI B11 links machine risk assessment with safeguard selection.",
    "estimatedReadSeconds": 9
  },
  "curriculum": {
    "scope": "mapped",
    "domainId": "d01",
    "competencyId": "d01_c07",
    "topicId": null,
    "subtopicId": null,
    "conceptIds": [
      "machine_risk_assessment",
      "safeguard_selection"
    ]
  },
  "provenance": {
    "sourceRegistryId": "SRC-03",
    "sourceClass": "consensus_standard",
    "sourceTitle": "ANSI B11 Machine Guarding Standards",
    "officialUrl": "https://www.assp.org/standards/standards-topics/machine-guarding-b11",
    "sourceLocator": "Machine guarding framework and task-based risk assessment overview",
    "editionOrRevision": "ANSI B11.0-2020 and ANSI B11.19-2019 (R2024)",
    "sourceSection": "What Are Machine Guarding Standards",
    "sourcePage": null,
    "sourcePublishedAt": null,
    "sourceVerifiedAt": "2026-09-23",
    "rightsTreatment": "original_paraphrase"
  },
  "claim": {
    "legalStatus": "consensus_standard",
    "jurisdiction": null,
    "numericalClaim": false,
    "safetyCritical": true,
    "simplificationRisk": "medium"
  },
  "tags": [
    "machine_safety",
    "risk_assessment",
    "safeguarding"
  ]
}
