{
  "schemaVersion": 1,
  "contentVersion": 1,
  "status": "review",
  "assessment": {
    "sensitivity": "none",
    "linkedQuestionConcepts": []
  },
  "review": {
    "technicalStatus": "pending",
    "sourceStatus": "pending",
    "pedagogyStatus": "pending",
    "copyrightStatus": "pending",
    "uiStatus": "pending",
    "humanTechnicalStatus": "pending",
    "reviewedAt": null,
    "nextReviewDueAt": null
  },
  "runtime": {
    "startupEligible": false
  },
  "supersession": {
    "supersedesMicroFactId": null,
    "supersededByMicroFactId": null
  },
  "microFactId": "mf_ml9_065",
  "category": "fire_electrical_insight",
  "display": {
    "displayText": "NFPA 72 treats inspection, testing, and maintenance as a dedicated part of the fire alarm and signaling system lifecycle, not merely an installation task.",
    "shortVariant": "Fire alarm reliability depends on inspection, testing, and maintenance after installation.",
    "estimatedReadSeconds": 10
  },
  "curriculum": {
    "scope": "mapped",
    "domainId": "d04",
    "competencyId": "d04_c03",
    "topicId": null,
    "subtopicId": null,
    "conceptIds": [
      "fire_alarm_systems",
      "inspection_testing_maintenance"
    ]
  },
  "provenance": {
    "sourceRegistryId": "SRC-05",
    "sourceClass": "consensus_standard",
    "sourceTitle": "NFPA 72, National Fire Alarm and Signaling Code",
    "officialUrl": "https://link.nfpa.org/all-publications/72/2022",
    "sourceLocator": "NFPA 72 (2022), Chapter 14 - Inspection, Testing, and Maintenance",
    "editionOrRevision": "NFPA 72, 2022 edition",
    "sourceSection": "Chapter 14",
    "sourcePage": null,
    "sourcePublishedAt": null,
    "sourceVerifiedAt": "2026-09-23",
    "rightsTreatment": "original_paraphrase"
  },
  "claim": {
    "legalStatus": "consensus_standard",
    "jurisdiction": null,
    "numericalClaim": false,
    "safetyCritical": true,
    "simplificationRisk": "medium"
  },
  "tags": [
    "fire_alarm",
    "inspection_testing_maintenance",
    "fire_protection"
  ]
}
