{
  "schemaVersion": 1,
  "contentVersion": 1,
  "status": "validated",
  "assessment": {
    "sensitivity": "none",
    "linkedQuestionConcepts": []
  },
  "review": {
    "technicalStatus": "pass",
    "sourceStatus": "pass",
    "pedagogyStatus": "pass",
    "copyrightStatus": "pass",
    "uiStatus": "pass",
    "humanTechnicalStatus": "pass",
    "reviewedAt": "2026-09-24",
    "nextReviewDueAt": "2027-09-24"
  },
  "runtime": {
    "startupEligible": false
  },
  "supersession": {
    "supersedesMicroFactId": null,
    "supersededByMicroFactId": null
  },
  "microFactId": "mf_ml9_005",
  "category": "safety_insight",
  "display": {
    "displayText": "OSHA requires powered industrial truck operators to demonstrate safe-operating competence through required training and workplace evaluation before operating independently.",
    "shortVariant": "Powered industrial truck operators need training and demonstrated workplace competence.",
    "estimatedReadSeconds": 9
  },
  "curriculum": {
    "scope": "mapped",
    "domainId": "d01",
    "competencyId": "d01_c06",
    "topicId": null,
    "subtopicId": null,
    "conceptIds": [
      "powered_industrial_trucks",
      "operator_competence"
    ]
  },
  "provenance": {
    "sourceRegistryId": "SRC-01",
    "sourceClass": "federal_regulation",
    "sourceTitle": "Powered industrial trucks, 29 CFR 1910.178",
    "officialUrl": "https://www.osha.gov/laws-regs/regulations/standardnumber/1910/1910.178",
    "sourceLocator": "29 CFR 1910.178(l)(1)",
    "editionOrRevision": "29 CFR 1910.178",
    "sourceSection": "1910.178(l)(1)",
    "sourcePage": null,
    "sourcePublishedAt": null,
    "sourceVerifiedAt": "2026-09-23",
    "rightsTreatment": "original_paraphrase"
  },
  "claim": {
    "legalStatus": "binding_requirement",
    "jurisdiction": "US Federal OSHA",
    "numericalClaim": false,
    "safetyCritical": true,
    "simplificationRisk": "medium"
  },
  "tags": [
    "powered_industrial_trucks",
    "operator_training",
    "competence"
  ]
}
