{
  "schemaVersion": 1,
  "contentVersion": 1,
  "status": "review",
  "assessment": {
    "sensitivity": "none",
    "linkedQuestionConcepts": []
  },
  "review": {
    "technicalStatus": "pending",
    "sourceStatus": "pending",
    "pedagogyStatus": "pending",
    "copyrightStatus": "pending",
    "uiStatus": "pending",
    "humanTechnicalStatus": "pending",
    "reviewedAt": null,
    "nextReviewDueAt": null
  },
  "runtime": {
    "startupEligible": false
  },
  "supersession": {
    "supersedesMicroFactId": null,
    "supersededByMicroFactId": null
  },
  "microFactId": "mf_ml9_034",
  "category": "ih_insight",
  "display": {
    "displayText": "NIOSH health-hazard evaluations may sample exposures across a full work shift or during a specific task, depending on the exposure question being investigated.",
    "shortVariant": "Exposure sampling can target a full shift or a specific task.",
    "estimatedReadSeconds": 9
  },
  "curriculum": {
    "scope": "mapped",
    "domainId": "d06",
    "competencyId": "d06_c01",
    "topicId": null,
    "subtopicId": null,
    "conceptIds": [
      "exposure_sampling",
      "task_based_sampling"
    ]
  },
  "provenance": {
    "sourceRegistryId": "SRC-02",
    "sourceClass": "research_or_prevention_guidance",
    "sourceTitle": "NIOSH Health Hazard Evaluations: Sampling for Exposures",
    "officialUrl": "https://www.cdc.gov/niosh/publications/numbered/2014-118.html",
    "sourceLocator": "About - full-shift and task-specific exposure sampling",
    "editionOrRevision": "DHHS (NIOSH) Publication No. 2014-118, revised April 2023",
    "sourceSection": "About",
    "sourcePage": null,
    "sourcePublishedAt": "2023-04-27",
    "sourceVerifiedAt": "2026-09-23",
    "rightsTreatment": "original_paraphrase"
  },
  "claim": {
    "legalStatus": "recommendation",
    "jurisdiction": null,
    "numericalClaim": false,
    "safetyCritical": true,
    "simplificationRisk": "low"
  },
  "tags": [
    "exposure_sampling",
    "task_sampling",
    "industrial_hygiene"
  ]
}
