{
  "schemaVersion": 1,
  "contentVersion": 1,
  "status": "review",
  "assessment": {
    "sensitivity": "none",
    "linkedQuestionConcepts": []
  },
  "review": {
    "technicalStatus": "pending",
    "sourceStatus": "pending",
    "pedagogyStatus": "pending",
    "copyrightStatus": "pending",
    "uiStatus": "pending",
    "humanTechnicalStatus": "pending",
    "reviewedAt": null,
    "nextReviewDueAt": null
  },
  "runtime": {
    "startupEligible": false
  },
  "supersession": {
    "supersedesMicroFactId": null,
    "supersededByMicroFactId": null
  },
  "microFactId": "mf_ml9_006",
  "category": "safety_insight",
  "display": {
    "displayText": "ISO 45001 frames occupational safety management around identifying hazards, assessing risks, applying controls, and continually improving the management system.",
    "shortVariant": "ISO 45001 links hazard identification, risk assessment, controls, and improvement.",
    "estimatedReadSeconds": 9
  },
  "curriculum": {
    "scope": "mapped",
    "domainId": "d03",
    "competencyId": "d03_c02",
    "topicId": null,
    "subtopicId": null,
    "conceptIds": [
      "ohs_risk_management",
      "risk_control"
    ]
  },
  "provenance": {
    "sourceRegistryId": "SRC-04",
    "sourceClass": "international_standard",
    "sourceTitle": "ISO 45001:2018 Occupational health and safety management systems",
    "officialUrl": "https://www.iso.org/standard/45001",
    "sourceLocator": "What is ISO 45001? and key elements",
    "editionOrRevision": "ISO 45001:2018, Edition 1; Amendment 1:2024",
    "sourceSection": "What is ISO 45001?",
    "sourcePage": null,
    "sourcePublishedAt": null,
    "sourceVerifiedAt": "2026-09-23",
    "rightsTreatment": "original_paraphrase"
  },
  "claim": {
    "legalStatus": "international_standard",
    "jurisdiction": null,
    "numericalClaim": false,
    "safetyCritical": true,
    "simplificationRisk": "medium"
  },
  "tags": [
    "risk_management",
    "iso_45001",
    "hazard_control"
  ]
}
