{
  "schemaVersion": 1,
  "contentVersion": 1,
  "status": "validated",
  "assessment": {
    "sensitivity": "none",
    "linkedQuestionConcepts": []
  },
  "review": {
    "technicalStatus": "pass",
    "sourceStatus": "pass",
    "pedagogyStatus": "pass",
    "copyrightStatus": "pass",
    "uiStatus": "pass",
    "humanTechnicalStatus": "pass",
    "reviewedAt": "2026-09-24",
    "nextReviewDueAt": "2027-09-24"
  },
  "runtime": {
    "startupEligible": false
  },
  "supersession": {
    "supersedesMicroFactId": null,
    "supersededByMicroFactId": null
  },
  "microFactId": "mf_ml9_063",
  "category": "fire_electrical_insight",
  "display": {
    "displayText": "OSHA requires workplace portable fire extinguishers to remain fully charged, operable, and in their designated locations except while being used.",
    "shortVariant": "Keep workplace fire extinguishers charged, operable, and properly located.",
    "estimatedReadSeconds": 9
  },
  "curriculum": {
    "scope": "mapped",
    "domainId": "d04",
    "competencyId": "d04_c03",
    "topicId": null,
    "subtopicId": null,
    "conceptIds": [
      "portable_fire_extinguishers",
      "extinguisher_readiness"
    ]
  },
  "provenance": {
    "sourceRegistryId": "SRC-01",
    "sourceClass": "federal_regulation",
    "sourceTitle": "Portable fire extinguishers, 29 CFR 1910.157",
    "officialUrl": "https://www.osha.gov/laws-regs/regulations/standardnumber/1910/1910.157",
    "sourceLocator": "29 CFR 1910.157(c)(4)",
    "editionOrRevision": "29 CFR 1910.157",
    "sourceSection": "1910.157(c)(4)",
    "sourcePage": null,
    "sourcePublishedAt": null,
    "sourceVerifiedAt": "2026-09-23",
    "rightsTreatment": "original_paraphrase"
  },
  "claim": {
    "legalStatus": "binding_requirement",
    "jurisdiction": "US Federal OSHA",
    "numericalClaim": false,
    "safetyCritical": true,
    "simplificationRisk": "low"
  },
  "tags": [
    "fire_extinguishers",
    "fire_protection",
    "equipment_readiness"
  ]
}
