{
  "schemaVersion": 1,
  "contentVersion": 1,
  "status": "published",
  "assessment": {
    "sensitivity": "none",
    "linkedQuestionConcepts": []
  },
  "review": {
    "technicalStatus": "pass",
    "sourceStatus": "pass",
    "pedagogyStatus": "pass",
    "copyrightStatus": "pass",
    "uiStatus": "pass",
    "humanTechnicalStatus": "pass",
    "reviewedAt": "2026-09-24",
    "nextReviewDueAt": "2027-09-24"
  },
  "runtime": {
    "startupEligible": true
  },
  "supersession": {
    "supersedesMicroFactId": null,
    "supersededByMicroFactId": null
  },
  "microFactId": "mf_ml9_027",
  "category": "ih_insight",
  "display": {
    "displayText": "NIOSH recommends gradual heat exposure for new and returning workers so physiological acclimatization can develop before full hot-work exposure.",
    "shortVariant": "Gradual heat exposure supports worker acclimatization.",
    "estimatedReadSeconds": 8
  },
  "curriculum": {
    "scope": "mapped",
    "domainId": "d06",
    "competencyId": "d06_c01",
    "topicId": null,
    "subtopicId": null,
    "conceptIds": [
      "heat_stress",
      "acclimatization"
    ]
  },
  "provenance": {
    "sourceRegistryId": "SRC-02",
    "sourceClass": "government_recommendation",
    "sourceTitle": "Acclimatization",
    "officialUrl": "https://www.cdc.gov/niosh/heat-stress/recommendations/acclimatization.html",
    "sourceLocator": "What to know and overview",
    "editionOrRevision": "Updated March 3, 2026",
    "sourceSection": "Acclimatization overview",
    "sourcePage": null,
    "sourcePublishedAt": "2026-03-03",
    "sourceVerifiedAt": "2026-09-23",
    "rightsTreatment": "original_paraphrase"
  },
  "claim": {
    "legalStatus": "recommendation",
    "jurisdiction": null,
    "numericalClaim": false,
    "safetyCritical": true,
    "simplificationRisk": "medium"
  },
  "tags": [
    "heat_stress",
    "acclimatization",
    "occupational_health"
  ]
}
