{
  "schemaVersion": 1,
  "contentVersion": 1,
  "status": "validated",
  "assessment": {
    "sensitivity": "none",
    "linkedQuestionConcepts": []
  },
  "review": {
    "technicalStatus": "pass",
    "sourceStatus": "pass",
    "pedagogyStatus": "pass",
    "copyrightStatus": "pass",
    "uiStatus": "pass",
    "humanTechnicalStatus": "pass",
    "reviewedAt": "2026-09-24",
    "nextReviewDueAt": "2027-09-24"
  },
  "runtime": {
    "startupEligible": false
  },
  "supersession": {
    "supersedesMicroFactId": null,
    "supersededByMicroFactId": null
  },
  "microFactId": "mf_ml9_107",
  "category": "transport_insight",
  "display": {
    "displayText": "FMCSA encourages commercial motor vehicle drivers and occupants to wear seat belts because restraints reduce injury risk during sudden stops and crashes.",
    "shortVariant": "Seat belts reduce injury risk for commercial vehicle occupants.",
    "estimatedReadSeconds": 9
  },
  "curriculum": {
    "scope": "mapped",
    "domainId": "d01",
    "competencyId": "d01_c05",
    "topicId": null,
    "subtopicId": null,
    "conceptIds": [
      "seat_belt_use",
      "occupant_protection"
    ]
  },
  "provenance": {
    "sourceRegistryId": "SRC-09",
    "sourceClass": "government_recommendation",
    "sourceTitle": "Buckle Up: CMV Seat Belt Usage Awareness",
    "officialUrl": "https://www.fmcsa.dot.gov/seatbelts",
    "sourceLocator": "Commercial motor vehicle seat-belt safety overview",
    "editionOrRevision": "Current FMCSA Buckle Up guidance",
    "sourceSection": "Buckle Up",
    "sourcePage": null,
    "sourcePublishedAt": null,
    "sourceVerifiedAt": "2026-09-23",
    "rightsTreatment": "original_paraphrase"
  },
  "claim": {
    "legalStatus": "recommendation",
    "jurisdiction": "US Federal DOT / FMCSA",
    "numericalClaim": false,
    "safetyCritical": true,
    "simplificationRisk": "low"
  },
  "tags": [
    "fleet_safety",
    "seat_belt_use",
    "occupant_protection"
  ]
}
