{
  "schemaVersion": 1,
  "contentVersion": 1,
  "status": "review",
  "assessment": {
    "sensitivity": "none",
    "linkedQuestionConcepts": []
  },
  "review": {
    "technicalStatus": "pending",
    "sourceStatus": "pending",
    "pedagogyStatus": "pending",
    "copyrightStatus": "pending",
    "uiStatus": "pending",
    "humanTechnicalStatus": "pending",
    "reviewedAt": null,
    "nextReviewDueAt": null
  },
  "runtime": {
    "startupEligible": false
  },
  "supersession": {
    "supersedesMicroFactId": null,
    "supersededByMicroFactId": null
  },
  "microFactId": "mf_ml9_056",
  "category": "process_safety_insight",
  "display": {
    "displayText": "ASSP risk guidance distinguishes failure-modes analysis from fault-tree analysis: one examines component failure effects, while the other works backward from an undesired top event.",
    "shortVariant": "Failure-modes and fault-tree analyses examine system failure from different directions.",
    "estimatedReadSeconds": 10
  },
  "curriculum": {
    "scope": "mapped",
    "domainId": "d02",
    "competencyId": "d02_c06",
    "topicId": null,
    "subtopicId": null,
    "conceptIds": [
      "failure_modes_effects_analysis",
      "fault_tree_analysis"
    ]
  },
  "provenance": {
    "sourceRegistryId": "SRC-13",
    "sourceClass": "professional_guideline",
    "sourceTitle": "Risk Assessment",
    "officialUrl": "https://www.assp.org/docs/default-source/psj-articles/f1lyon_0620.pdf",
    "sourceLocator": "Risk-assessment techniques table - failure modes and effects analysis and fault-tree analysis",
    "editionOrRevision": "ASSP Professional Safety risk-assessment article, June 2020",
    "sourceSection": "Risk Assessment Techniques",
    "sourcePage": null,
    "sourcePublishedAt": "2020-06-01",
    "sourceVerifiedAt": "2026-09-24",
    "rightsTreatment": "original_paraphrase"
  },
  "claim": {
    "legalStatus": "professional_guideline",
    "jurisdiction": null,
    "numericalClaim": false,
    "safetyCritical": false,
    "simplificationRisk": "medium"
  },
  "tags": [
    "system_safety",
    "failure_modes",
    "fault_tree"
  ]
}
