{
  "schemaVersion": 1,
  "contentVersion": 1,
  "status": "published",
  "assessment": {
    "sensitivity": "none",
    "linkedQuestionConcepts": []
  },
  "review": {
    "technicalStatus": "pass",
    "sourceStatus": "pass",
    "pedagogyStatus": "pass",
    "copyrightStatus": "pass",
    "uiStatus": "pass",
    "humanTechnicalStatus": "pass",
    "reviewedAt": "2026-09-24",
    "nextReviewDueAt": "2027-09-24"
  },
  "runtime": {
    "startupEligible": true
  },
  "supersession": {
    "supersedesMicroFactId": null,
    "supersededByMicroFactId": null
  },
  "microFactId": "mf_ml9_072",
  "category": "fire_electrical_insight",
  "display": {
    "displayText": "NFPA flammable-liquid guidance applies safeguards to storage, handling, and use because controlling liquid fire hazards requires more than controlling the container alone.",
    "shortVariant": "Flammable-liquid safety covers storage, handling, and use as one system.",
    "estimatedReadSeconds": 9
  },
  "curriculum": {
    "scope": "mapped",
    "domainId": "d01",
    "competencyId": "d01_c03",
    "topicId": null,
    "subtopicId": null,
    "conceptIds": [
      "flammable_liquid_safeguards",
      "storage_handling_use"
    ]
  },
  "provenance": {
    "sourceRegistryId": "SRC-05",
    "sourceClass": "consensus_standard",
    "sourceTitle": "NFPA 30, Flammable and Combustible Liquids Code",
    "officialUrl": "https://link.nfpa.org/all-publications/30/2024",
    "sourceLocator": "Scope - safeguards for storage, handling, and use of flammable and combustible liquids",
    "editionOrRevision": "NFPA 30, 2024 edition",
    "sourceSection": "Scope",
    "sourcePage": null,
    "sourcePublishedAt": "2023-01-01",
    "sourceVerifiedAt": "2026-09-24",
    "rightsTreatment": "original_paraphrase"
  },
  "claim": {
    "legalStatus": "consensus_standard",
    "jurisdiction": null,
    "numericalClaim": false,
    "safetyCritical": true,
    "simplificationRisk": "low"
  },
  "tags": [
    "flammable_liquids",
    "fire_prevention",
    "storage_handling"
  ]
}
