{
  "schemaVersion": 1,
  "contentVersion": 1,
  "status": "published",
  "assessment": {
    "sensitivity": "none",
    "linkedQuestionConcepts": []
  },
  "review": {
    "technicalStatus": "pass",
    "sourceStatus": "pass",
    "pedagogyStatus": "pass",
    "copyrightStatus": "pass",
    "uiStatus": "pass",
    "humanTechnicalStatus": "pass",
    "reviewedAt": "2026-09-24",
    "nextReviewDueAt": "2027-09-24"
  },
  "runtime": {
    "startupEligible": true
  },
  "supersession": {
    "supersedesMicroFactId": null,
    "supersededByMicroFactId": null
  },
  "microFactId": "mf_ml9_066",
  "category": "fire_electrical_insight",
  "display": {
    "displayText": "NFPA electrical-safety guidance defines an electrically safe work condition through disconnection, lockout or tagout, absence-of-voltage verification, and grounding when personnel protection requires it.",
    "shortVariant": "Electrical safety combines isolation, lockout, voltage verification, and grounding when needed.",
    "estimatedReadSeconds": 10
  },
  "curriculum": {
    "scope": "mapped",
    "domainId": "d01",
    "competencyId": "d01_c03",
    "topicId": null,
    "subtopicId": null,
    "conceptIds": [
      "electrically_safe_work_condition",
      "absence_of_voltage_verification"
    ]
  },
  "provenance": {
    "sourceRegistryId": "SRC-05",
    "sourceClass": "consensus_standard",
    "sourceTitle": "NFPA 70E, Standard for Electrical Safety in the Workplace",
    "officialUrl": "https://link.nfpa.org/all-publications/70E/2024",
    "sourceLocator": "Definition of Electrically Safe Work Condition and Chapter 1 safety-related work practices",
    "editionOrRevision": "NFPA 70E, 2024 edition",
    "sourceSection": "Chapter 1 - Safety-Related Work Practices",
    "sourcePage": null,
    "sourcePublishedAt": "2023-01-01",
    "sourceVerifiedAt": "2026-09-24",
    "rightsTreatment": "original_paraphrase"
  },
  "claim": {
    "legalStatus": "consensus_standard",
    "jurisdiction": null,
    "numericalClaim": false,
    "safetyCritical": true,
    "simplificationRisk": "medium"
  },
  "tags": [
    "electrical_safety",
    "safe_work_condition",
    "voltage_verification"
  ]
}
