{
  "schemaVersion": 1,
  "contentVersion": 1,
  "status": "review",
  "assessment": {
    "sensitivity": "none",
    "linkedQuestionConcepts": []
  },
  "review": {
    "technicalStatus": "pending",
    "sourceStatus": "pending",
    "pedagogyStatus": "pending",
    "copyrightStatus": "pending",
    "uiStatus": "pending",
    "humanTechnicalStatus": "pending",
    "reviewedAt": null,
    "nextReviewDueAt": null
  },
  "runtime": {
    "startupEligible": false
  },
  "supersession": {
    "supersedesMicroFactId": null,
    "supersededByMicroFactId": null
  },
  "microFactId": "mf_ml9_047",
  "category": "process_safety_insight",
  "display": {
    "displayText": "OSHA requires a process hazard analysis for covered processes that is appropriate to process complexity and identifies, evaluates, and controls process hazards.",
    "shortVariant": "A process hazard analysis must match process complexity and address hazards.",
    "estimatedReadSeconds": 9
  },
  "curriculum": {
    "scope": "mapped",
    "domainId": "d01",
    "competencyId": "d01_c02",
    "topicId": null,
    "subtopicId": null,
    "conceptIds": [
      "process_hazard_analysis",
      "process_safety"
    ]
  },
  "provenance": {
    "sourceRegistryId": "SRC-01",
    "sourceClass": "federal_regulation",
    "sourceTitle": "Process safety management of highly hazardous chemicals, 29 CFR 1910.119",
    "officialUrl": "https://www.osha.gov/laws-regs/regulations/standardnumber/1910/1910.119",
    "sourceLocator": "29 CFR 1910.119(e)(1)",
    "editionOrRevision": "29 CFR 1910.119",
    "sourceSection": "1910.119(e)(1)",
    "sourcePage": null,
    "sourcePublishedAt": null,
    "sourceVerifiedAt": "2026-09-23",
    "rightsTreatment": "original_paraphrase"
  },
  "claim": {
    "legalStatus": "binding_requirement",
    "jurisdiction": "US Federal OSHA",
    "numericalClaim": false,
    "safetyCritical": true,
    "simplificationRisk": "medium"
  },
  "tags": [
    "process_hazard_analysis",
    "process_safety",
    "hazard_evaluation"
  ]
}
