{
  "schemaVersion": 1,
  "contentVersion": 1,
  "status": "validated",
  "assessment": {
    "sensitivity": "none",
    "linkedQuestionConcepts": []
  },
  "review": {
    "technicalStatus": "pass",
    "sourceStatus": "pass",
    "pedagogyStatus": "pass",
    "copyrightStatus": "pass",
    "uiStatus": "pass",
    "humanTechnicalStatus": "pass",
    "reviewedAt": "2026-09-24",
    "nextReviewDueAt": "2027-09-24"
  },
  "runtime": {
    "startupEligible": false
  },
  "supersession": {
    "supersedesMicroFactId": null,
    "supersededByMicroFactId": null
  },
  "microFactId": "mf_ml9_090",
  "category": "environmental_insight",
  "display": {
    "displayText": "EPA's waste-management hierarchy places source reduction ahead of reuse, recycling, treatment, and disposal because pollution prevention acts before waste is created.",
    "shortVariant": "EPA prioritizes preventing pollution at the source before managing waste later.",
    "estimatedReadSeconds": 10
  },
  "curriculum": {
    "scope": "mapped",
    "domainId": "d05",
    "competencyId": "d05_c01",
    "topicId": null,
    "subtopicId": null,
    "conceptIds": [
      "pollution_prevention",
      "source_reduction"
    ]
  },
  "provenance": {
    "sourceRegistryId": "SRC-08",
    "sourceClass": "government_recommendation",
    "sourceTitle": "Learn About Pollution Prevention",
    "officialUrl": "https://www.epa.gov/p2/learn-about-pollution-prevention",
    "sourceLocator": "What is P2? and EPA Waste Management Hierarchy",
    "editionOrRevision": "Current EPA pollution-prevention guidance verified September 24, 2026",
    "sourceSection": "What is P2?",
    "sourcePage": null,
    "sourcePublishedAt": null,
    "sourceVerifiedAt": "2026-09-24",
    "rightsTreatment": "original_paraphrase"
  },
  "claim": {
    "legalStatus": "recommendation",
    "jurisdiction": null,
    "numericalClaim": false,
    "safetyCritical": false,
    "simplificationRisk": "low"
  },
  "tags": [
    "pollution_prevention",
    "source_reduction",
    "waste_hierarchy"
  ]
}
