{
  "schemaVersion": 1,
  "contentVersion": 1,
  "status": "validated",
  "assessment": {
    "sensitivity": "none",
    "linkedQuestionConcepts": []
  },
  "review": {
    "technicalStatus": "pass",
    "sourceStatus": "pass",
    "pedagogyStatus": "pass",
    "copyrightStatus": "pass",
    "uiStatus": "pass",
    "humanTechnicalStatus": "pass",
    "reviewedAt": "2026-09-24",
    "nextReviewDueAt": "2027-09-24"
  },
  "runtime": {
    "startupEligible": false
  },
  "supersession": {
    "supersedesMicroFactId": null,
    "supersededByMicroFactId": null
  },
  "microFactId": "mf_ml9_042",
  "category": "ih_insight",
  "display": {
    "displayText": "Physical-agent exposure limits may depend on several measured parameters and worker effects, so trained evaluation matters more than treating every hazard as one number.",
    "shortVariant": "Physical-agent assessment may require several measurements, not one number.",
    "estimatedReadSeconds": 9
  },
  "curriculum": {
    "scope": "mapped",
    "domainId": "d06",
    "competencyId": "d06_c01",
    "topicId": null,
    "subtopicId": null,
    "conceptIds": [
      "physical_agent_measurement",
      "multivariable_exposure_assessment"
    ]
  },
  "provenance": {
    "sourceRegistryId": "SRC-06",
    "sourceClass": "professional_guideline",
    "sourceTitle": "Threshold Limit Values for Physical Agents Introduction",
    "officialUrl": "https://www.acgih.org/science/tlv-bei-guidelines/tlv-physical-agents-introduction/",
    "sourceLocator": "Physical agents measurement and evaluation principles",
    "editionOrRevision": "2026 ACGIH physical agents guidance, verified September 23, 2026",
    "sourceSection": "Introduction to the Physical Agents TLVs",
    "sourcePage": null,
    "sourcePublishedAt": null,
    "sourceVerifiedAt": "2026-09-23",
    "rightsTreatment": "original_paraphrase"
  },
  "claim": {
    "legalStatus": "professional_guideline",
    "jurisdiction": null,
    "numericalClaim": false,
    "safetyCritical": true,
    "simplificationRisk": "medium"
  },
  "tags": [
    "physical_agents",
    "exposure_measurement",
    "industrial_hygiene"
  ]
}
