{
  "schemaVersion": 1,
  "contentVersion": 1,
  "status": "published",
  "assessment": {
    "sensitivity": "none",
    "linkedQuestionConcepts": []
  },
  "review": {
    "technicalStatus": "pass",
    "sourceStatus": "pass",
    "pedagogyStatus": "pass",
    "copyrightStatus": "pass",
    "uiStatus": "pass",
    "humanTechnicalStatus": "pass",
    "reviewedAt": "2026-09-24",
    "nextReviewDueAt": "2027-09-24"
  },
  "runtime": {
    "startupEligible": true
  },
  "supersession": {
    "supersedesMicroFactId": null,
    "supersededByMicroFactId": null
  },
  "microFactId": "mf_ml9_028",
  "category": "ih_insight",
  "display": {
    "displayText": "NIOSH recommends engineering controls for workplace noise before relying only on hearing protection because controls reduce noise at the source or along its path.",
    "shortVariant": "Control workplace noise before relying only on hearing protection.",
    "estimatedReadSeconds": 10
  },
  "curriculum": {
    "scope": "mapped",
    "domainId": "d06",
    "competencyId": "d06_c01",
    "topicId": null,
    "subtopicId": null,
    "conceptIds": [
      "noise_control",
      "engineering_controls"
    ]
  },
  "provenance": {
    "sourceRegistryId": "SRC-02",
    "sourceClass": "research_or_prevention_guidance",
    "sourceTitle": "Implement Engineering Controls",
    "officialUrl": "https://www.cdc.gov/niosh/noise/prevent/engineering.html",
    "sourceLocator": "Key points and What are noise controls?",
    "editionOrRevision": "Updated February 16, 2024",
    "sourceSection": "Implement Engineering Controls",
    "sourcePage": null,
    "sourcePublishedAt": "2024-02-16",
    "sourceVerifiedAt": "2026-09-23",
    "rightsTreatment": "original_paraphrase"
  },
  "claim": {
    "legalStatus": "recommendation",
    "jurisdiction": null,
    "numericalClaim": false,
    "safetyCritical": true,
    "simplificationRisk": "low"
  },
  "tags": [
    "noise_control",
    "engineering_controls",
    "hearing_loss_prevention"
  ]
}
