{
  "schemaVersion": 1,
  "contentVersion": 1,
  "status": "published",
  "assessment": {
    "sensitivity": "none",
    "linkedQuestionConcepts": []
  },
  "review": {
    "technicalStatus": "pass",
    "sourceStatus": "pass",
    "pedagogyStatus": "pass",
    "copyrightStatus": "pass",
    "uiStatus": "pass",
    "humanTechnicalStatus": "pass",
    "reviewedAt": "2026-09-24",
    "nextReviewDueAt": "2027-09-24"
  },
  "runtime": {
    "startupEligible": true
  },
  "supersession": {
    "supersedesMicroFactId": null,
    "supersededByMicroFactId": null
  },
  "microFactId": "mf_ml9_083",
  "category": "management_insight",
  "display": {
    "displayText": "ASSP project guidance emphasizes a clear project charter, timelines, objectives, ownership, and structured stakeholder communication to keep multidisciplinary work coordinated.",
    "shortVariant": "Clear charters, timelines, ownership, and communication strengthen project coordination.",
    "estimatedReadSeconds": 10
  },
  "curriculum": {
    "scope": "mapped",
    "domainId": "d02",
    "competencyId": "d02_c13",
    "topicId": null,
    "subtopicId": null,
    "conceptIds": [
      "project_charter",
      "stakeholder_coordination"
    ]
  },
  "provenance": {
    "sourceRegistryId": "SRC-13",
    "sourceClass": "professional_guideline",
    "sourceTitle": "Tips for Successfully Communicating With Engineers",
    "officialUrl": "https://www.assp.org/docs/default-source/psj-articles/cpjunkin_0923.pdf",
    "sourceLocator": "Structured meetings, project charter, timelines, objectives, and ownership",
    "editionOrRevision": "Professional Safety, September 2023",
    "sourceSection": "Project communication and structured meetings",
    "sourcePage": "40-41",
    "sourcePublishedAt": "2023-09-01",
    "sourceVerifiedAt": "2026-09-24",
    "rightsTreatment": "original_paraphrase"
  },
  "claim": {
    "legalStatus": "professional_guideline",
    "jurisdiction": null,
    "numericalClaim": false,
    "safetyCritical": false,
    "simplificationRisk": "low"
  },
  "tags": [
    "project_management",
    "stakeholder_coordination",
    "project_timeline"
  ]
}
